### ISSUE TITLE
ping doesn't work for IPv6

### ISSUE THREAD

**Issue by bluecmd** [u-root/u-root#1009]
From u-root:

```
/# ping -6 2606:4700:4700::1111
1970/01/01 02:58:26 ping failed: Read failed: read ip6 fc00::7efe:90ff:fe41:3f0->2606:4700:4700::1111: i/o timeout
Exception: ping exited with 1
[tty], line 1: ping -6 2606:4700:4700::1111
```

This results in:

```
18:47:20.897252 IP6 fc00::7efe:90ff:fe41:3f0 > one.one.one.one: ICMP6, unknown icmp6 type (8), length 64
	0x0000:  0800 243c 0000 0001 0000 0000 0000 0000
	0x0010:  0000 0000 0000 0000 0000 0000 0000 0000
	0x0020:  0000 0000 0000 0000 0000 0000 0000 0000
	0x0030:  0000 0000 0000 0000 0000 0000 0000 0000
```

From a normal Linux:

```
$ ping6 2606:4700:4700::1111
PING 2606:4700:4700::1111(2606:4700:4700::1111) 56 data bytes
64 bytes from 2606:4700:4700::1111: icmp_seq=1 ttl=60 time=89.3 ms
64 bytes from 2606:4700:4700::1111: icmp_seq=2 ttl=60 time=91.7 ms
```

```
18:47:04.435071 IP6 2002:9242:eb4d::1 > one.one.one.one: ICMP6, echo request, seq 3, length 64
18:47:04.520423 IP6 one.one.one.one > 2002:9242:eb4d::1: ICMP6, echo reply, seq 3, length 64
```

From the output it seems like the ICMP type is reused from IPv4.

Stretch goal: make it possible to ping multicast addresses like `ff02::1`:

```
/# ping -6 ff02::1%ens224
1970/01/01 03:01:37 ping failed: net.Dial(ip6:ipv6-icmp ff02::1%ens224) failed: dial ip6:ipv6-icmp ff02::1%ens224: connect: invalid argument
Exception: ping exited with 1
[tty], line 1: ping -6 ff02::1%ens224
```
